[
  {
    "action": "deprecate",
    "provider": "openai",
    "model": "gpt-4-turbo",
    "reason": "Model status is deprecated",
    "evidence": {
      "registry": {
        "provider": "openai",
        "model": "gpt-4-turbo",
        "status": "deprecated",
        "last_checked_iso": "2025-09-13T17:45:39.612314Z",
        "endpoint": "https://api.openai.com/v1/chat/completions",
        "params": {
          "temperature": 0.7,
          "max_tokens": 4096
        },
        "capabilities": {
          "tools": true,
          "search_augmented": false,
          "max_context": 128000,
          "cost_per_1k_tokens": 0.01
        }
      },
      "contract": {
        "provider": "openai",
        "model": "gpt-4-turbo",
        "status": "deprecated",
        "last_checked_iso": "2025-09-13T17:45:39.612314Z",
        "endpoint": "https://api.openai.com/v1/chat/completions",
        "params": {
          "temperature": 0.7,
          "max_tokens": 4096
        },
        "capabilities": {
          "tools": true,
          "search_augmented": false,
          "max_context": 128000,
          "cost_per_1k_tokens": 0.01
        },
        "contract_ok": false,
        "reason": "status=deprecated",
        "canary_tests": {}
      }
    },
    "impact": {
      "delta_mii": -0.5,
      "budget_delta": 0.0,
      "coverage_tier": "degraded"
    },
    "timestamp": "2025-09-13T17:45:40.020502Z"
  },
  {
    "action": "deprecate",
    "provider": "anthropic",
    "model": "claude-3-5-sonnet-20240620",
    "reason": "Model status is deprecated",
    "evidence": {
      "registry": {
        "provider": "anthropic",
        "model": "claude-3-5-sonnet-20240620",
        "status": "deprecated",
        "last_checked_iso": "2025-09-13T17:45:39.612314Z",
        "endpoint": "https://api.anthropic.com/v1/messages",
        "params": {
          "max_tokens": 4096,
          "temperature": 0.7
        },
        "capabilities": {
          "tools": true,
          "search_augmented": false,
          "max_context": 200000,
          "cost_per_1k_tokens": 0.003
        }
      },
      "contract": {
        "provider": "anthropic",
        "model": "claude-3-5-sonnet-20240620",
        "status": "deprecated",
        "last_checked_iso": "2025-09-13T17:45:39.612314Z",
        "endpoint": "https://api.anthropic.com/v1/messages",
        "params": {
          "max_tokens": 4096,
          "temperature": 0.7
        },
        "capabilities": {
          "tools": true,
          "search_augmented": false,
          "max_context": 200000,
          "cost_per_1k_tokens": 0.003
        },
        "contract_ok": false,
        "reason": "status=deprecated",
        "canary_tests": {}
      }
    },
    "impact": {
      "delta_mii": -0.5,
      "budget_delta": 0.0,
      "coverage_tier": "degraded"
    },
    "timestamp": "2025-09-13T17:45:40.020502Z"
  },
  {
    "action": "remove",
    "provider": "openai",
    "model": "gpt-4o",
    "reason": "Contract validation failed: contract_failed",
    "evidence": {
      "registry": {
        "provider": "openai",
        "model": "gpt-4o",
        "status": "active",
        "last_checked_iso": "2025-09-13T17:45:39.612314Z",
        "endpoint": "https://api.openai.com/v1/chat/completions",
        "params": {
          "temperature": 0.7,
          "max_tokens": 4096,
          "top_p": 1.0
        },
        "capabilities": {
          "tools": true,
          "search_augmented": false,
          "max_context": 128000,
          "cost_per_1k_tokens": 0.005
        }
      },
      "contract": {
        "provider": "openai",
        "model": "gpt-4o",
        "status": "active",
        "last_checked_iso": "2025-09-13T17:45:39.612314Z",
        "endpoint": "https://api.openai.com/v1/chat/completions",
        "params": {
          "temperature": 0.7,
          "max_tokens": 4096,
          "top_p": 1.0
        },
        "capabilities": {
          "tools": true,
          "search_augmented": false,
          "max_context": 128000,
          "cost_per_1k_tokens": 0.005
        },
        "contract_ok": false,
        "reason": "contract_failed",
        "canary_tests": {
          "basic": {
            "ok": false,
            "error": "401 Client Error: Unauthorized for url: https://api.openai.com/v1/chat/completions"
          }
        },
        "canary_timestamp": "2025-09-13T17:45:39.826786Z"
      },
      "canary_tests": {
        "basic": {
          "ok": false,
          "error": "401 Client Error: Unauthorized for url: https://api.openai.com/v1/chat/completions"
        }
      }
    },
    "impact": {
      "delta_mii": -1.0,
      "budget_delta": 0.0,
      "coverage_tier": "degraded"
    },
    "timestamp": "2025-09-13T17:45:40.020502Z"
  },
  {
    "action": "remove",
    "provider": "openai",
    "model": "gpt-4o-mini",
    "reason": "Contract validation failed: not_routed",
    "evidence": {
      "registry": {
        "provider": "openai",
        "model": "gpt-4o-mini",
        "status": "active",
        "last_checked_iso": "2025-09-13T17:45:39.612314Z",
        "endpoint": "https://api.openai.com/v1/chat/completions",
        "params": {
          "temperature": 0.7,
          "max_tokens": 4096,
          "top_p": 1.0
        },
        "capabilities": {
          "tools": true,
          "search_augmented": false,
          "max_context": 128000,
          "cost_per_1k_tokens": 0.00015
        }
      },
      "contract": {
        "provider": "openai",
        "model": "gpt-4o-mini",
        "status": "active",
        "last_checked_iso": "2025-09-13T17:45:39.612314Z",
        "endpoint": "https://api.openai.com/v1/chat/completions",
        "params": {
          "temperature": 0.7,
          "max_tokens": 4096,
          "top_p": 1.0
        },
        "capabilities": {
          "tools": true,
          "search_augmented": false,
          "max_context": 128000,
          "cost_per_1k_tokens": 0.00015
        },
        "contract_ok": false,
        "reason": "not_routed",
        "canary_tests": {}
      },
      "canary_tests": {}
    },
    "impact": {
      "delta_mii": -1.0,
      "budget_delta": 0.0,
      "coverage_tier": "degraded"
    },
    "timestamp": "2025-09-13T17:45:40.020502Z"
  },
  {
    "action": "remove",
    "provider": "openai",
    "model": "gpt-3.5-turbo",
    "reason": "Contract validation failed: not_routed",
    "evidence": {
      "registry": {
        "provider": "openai",
        "model": "gpt-3.5-turbo",
        "status": "active",
        "last_checked_iso": "2025-09-13T17:45:39.612314Z",
        "endpoint": "https://api.openai.com/v1/chat/completions",
        "params": {
          "temperature": 0.7,
          "max_tokens": 4096
        },
        "capabilities": {
          "tools": true,
          "search_augmented": false,
          "max_context": 16385,
          "cost_per_1k_tokens": 0.0005
        }
      },
      "contract": {
        "provider": "openai",
        "model": "gpt-3.5-turbo",
        "status": "active",
        "last_checked_iso": "2025-09-13T17:45:39.612314Z",
        "endpoint": "https://api.openai.com/v1/chat/completions",
        "params": {
          "temperature": 0.7,
          "max_tokens": 4096
        },
        "capabilities": {
          "tools": true,
          "search_augmented": false,
          "max_context": 16385,
          "cost_per_1k_tokens": 0.0005
        },
        "contract_ok": false,
        "reason": "not_routed",
        "canary_tests": {}
      },
      "canary_tests": {}
    },
    "impact": {
      "delta_mii": -1.0,
      "budget_delta": 0.0,
      "coverage_tier": "degraded"
    },
    "timestamp": "2025-09-13T17:45:40.020502Z"
  },
  {
    "action": "remove",
    "provider": "anthropic",
    "model": "claude-3-5-sonnet-20241022",
    "reason": "Contract validation failed: not_routed",
    "evidence": {
      "registry": {
        "provider": "anthropic",
        "model": "claude-3-5-sonnet-20241022",
        "status": "active",
        "last_checked_iso": "2025-09-13T17:45:39.612314Z",
        "endpoint": "https://api.anthropic.com/v1/messages",
        "params": {
          "max_tokens": 4096,
          "temperature": 0.7
        },
        "capabilities": {
          "tools": true,
          "search_augmented": false,
          "max_context": 200000,
          "cost_per_1k_tokens": 0.003
        }
      },
      "contract": {
        "provider": "anthropic",
        "model": "claude-3-5-sonnet-20241022",
        "status": "active",
        "last_checked_iso": "2025-09-13T17:45:39.612314Z",
        "endpoint": "https://api.anthropic.com/v1/messages",
        "params": {
          "max_tokens": 4096,
          "temperature": 0.7
        },
        "capabilities": {
          "tools": true,
          "search_augmented": false,
          "max_context": 200000,
          "cost_per_1k_tokens": 0.003
        },
        "contract_ok": false,
        "reason": "not_routed",
        "canary_tests": {}
      },
      "canary_tests": {}
    },
    "impact": {
      "delta_mii": -1.0,
      "budget_delta": 0.0,
      "coverage_tier": "degraded"
    },
    "timestamp": "2025-09-13T17:45:40.020502Z"
  },
  {
    "action": "remove",
    "provider": "anthropic",
    "model": "claude-3-5-haiku-20241022",
    "reason": "Contract validation failed: not_routed",
    "evidence": {
      "registry": {
        "provider": "anthropic",
        "model": "claude-3-5-haiku-20241022",
        "status": "active",
        "last_checked_iso": "2025-09-13T17:45:39.612314Z",
        "endpoint": "https://api.anthropic.com/v1/messages",
        "params": {
          "max_tokens": 4096,
          "temperature": 0.7
        },
        "capabilities": {
          "tools": true,
          "search_augmented": false,
          "max_context": 200000,
          "cost_per_1k_tokens": 0.0008
        }
      },
      "contract": {
        "provider": "anthropic",